{
  "$schema": "../../catalog/schemas/ad.schema.json",
  "id": "my-ad-id",
  "title": "Working title",
  "brief": "Who it's for, the single idea, the hook, and what the viewer should feel. One paragraph.",
  "hook": "What happens in the first second.",
  "channels": ["tiktok", "reels"],
  "formats": ["9x16"],
  "lengths": [15],
  "fps": 30,
  "track": "music.mixkit.gummies-michael-ramir-c.v1",
  "assets": ["music.mixkit.gummies-michael-ramir-c.v1", "brand.curate.logo-splash.v1", "font.geist.medium.v1"],
  "components": ["Ground", "Track", "Words", "Logo", "BeatClock"],
  "status": "idea",
  "disclosures": [],
  "createdBy": { "type": "agent", "name": "your-agent-name", "at": "YYYY-MM-DD" }
}
