{
  "$schema": "../../catalog/schemas/ad.schema.json",
  "id": "pop-out",
  "title": "Pop out",
  "brief": "Curate's first real ad, for people who have never heard of Curate (TikTok, Reels, Shorts; a 4:5 cut for the Instagram feed). The single idea: your closet is already in your photos. Emma's phone lies on a desk showing her real camera roll; on Cat Walk's beat her real pieces burst out of her own photos with an overshoot, hold and sink back home, while the line types on behind them. The phone turns face-on and the roll match-cuts into the app's real scan of that same roll (same photos, same grid), her pieces arrive, the Wardrobe floats in depth, end card. From concept c14 and the founder's reference reel. 6 s is a seamless loop; 30 s adds Found 30 photos of you, Zee's cheer on the music's break, a look card and a try-on.",
  "hook": "0–0.5 s: a phone on a desk shows a camera roll; on the drop a black leather jacket bursts out of one of her photos toward the lens.",
  "channels": [
    "tiktok",
    "reels",
    "shorts",
    "meta-feed"
  ],
  "formats": [
    "9x16",
    "4x5",
    "1x1"
  ],
  "lengths": [
    6,
    15,
    30
  ],
  "fps": 30,
  "track": "music.mixkit.cat-walk-arulo.v1",
  "assets": [
    "music.mixkit.cat-walk-arulo.v1",
    "font.geist.regular.v1",
    "font.geist.medium.v1",
    "font.geist.semibold.v1",
    "zee.curious.intro.v1",
    "zee.curious.loop.v1",
    "brand.curate.splash-mark.v1",
    "footage.emma.look-card-landing.v1",
    "footage.emma.look-love-it.v1",
    "footage.emma.pieces-up-and-tuck.v1",
    "footage.emma.scan-found-end.v1",
    "footage.emma.scan-roll.v1",
    "footage.emma.tryon-curtain-reveal.v1",
    "footage.emma.wardrobe-ready-cheer.v1",
    "footage.emma.wardrobe-scroll-float.v1",
    "garment.emma.bag-crossbody-tan.v1",
    "garment.emma.bag-tote-leather-black.v1",
    "garment.emma.blazer-black.v1",
    "garment.emma.camisole-satin-black.v1",
    "garment.emma.coat-trench-khaki.v1",
    "garment.emma.jacket-denim.v1",
    "garment.emma.jacket-leather-black.v1",
    "garment.emma.jacket-varsity-navy-cream.v1",
    "garment.emma.jeans-straight-dark-wash.v1",
    "garment.emma.jeans-straight-light-wash.v1",
    "garment.emma.shirt-oxford-blue.v1",
    "garment.emma.skirt-midi-satin-camel.v1",
    "garment.emma.sneakers-leather-white.v1",
    "garment.emma.sports-bra-sage.v1",
    "garment.emma.sweater-cable-knit-cream.v1",
    "garment.emma.tee-long-sleeve-striped.v1",
    "garment.emma.tee-white.v1",
    "photo.emma.r17-brunch.v1",
    "photo.emma.r18-office-lobby.v1",
    "photo.emma.r19-fall-game-day.v1",
    "photo.emma.r20-country-night.v1",
    "photo.emma.r21-museum-steps.v1",
    "photo.emma.r22-stoop.v1",
    "photo.emma.r23-rainy-day.v1",
    "photo.emma.r24-dinner.v1",
    "photo.emma.r25-cafe-laptop.v1",
    "photo.emma.r26-ferry.v1",
    "photo.emma.r27-chelsea-market.v1",
    "photo.emma.r28-couch-cozy.v1",
    "photo.emma.r29-gym-mirror.v1",
    "photo.emma.r30-walk-to-work.v1",
    "selfie.emma.selfie.v1",
    "stock.unsplash.autumn-bench.v1",
    "stock.unsplash.beach-empty-highrise.v1",
    "stock.unsplash.brunch-blueberry-toast.v1",
    "stock.unsplash.brunch-egg-toast.v1",
    "stock.unsplash.brunch-waffles.v1",
    "stock.unsplash.coffee-mug-hand.v1",
    "stock.unsplash.dog-4.v1",
    "stock.unsplash.dog-5.v1",
    "stock.unsplash.dog-golden-retriever-2.v1",
    "stock.unsplash.flowers-vase.v1",
    "stock.unsplash.food-donut-box.v1",
    "stock.unsplash.hands-cheers-glasses.v1",
    "stock.unsplash.nyc-central-park.v1",
    "stock.unsplash.nyc-skyline-east-river.v1",
    "stock.unsplash.nyc-williamsburg-bridge.v1",
    "stock.unsplash.pizza-pepperoni.v1",
    "stock.unsplash.pizza-picking-slice.v1",
    "stock.unsplash.pizza-slice-hand.v1",
    "stock.unsplash.sunset-sea-clouds.v1",
    "stock.unsplash.sunset-trees-lake.v1",
    "stock.unsplash.sunset-wave.v1"
  ],
  "components": [
    "PhoneFrame",
    "projectOnPhone",
    "Footage",
    "Piece",
    "popCurve",
    "ScanDots",
    "MotionBlur",
    "Flash",
    "StoreEndCard",
    "ZeeActor",
    "Track",
    "BeatClock",
    "planScenes",
    "useFrameBox"
  ],
  "status": "draft",
  "disclosures": [
    "Emma is an AI-generated persona and her photos and try-on are AI-generated: turn on the platform AI label (TikTok \"AI-generated content\", Meta \"AI info\", YouTube \"altered or synthetic content\").",
    "The app footage is real (Curate 1.5.0, build 262, Emma's account); the scan, the pieces and the Wardrobe are shown as they happen, sped up 1.3–1.6x in places.",
    "Music: Mixkit Stock Music Free License (Cat Walk, Arulo): online and social ads are fine; no TV/radio, never register it with Content ID."
  ],
  "createdBy": {
    "type": "agent",
    "name": "claude-code (real-ads agent)",
    "at": "2026-10-15"
  },
  "notes": "Rendered: 9x16 at 6, 15 and 30 s; 4x5 (Instagram feed) at 6, 15 and 30 s; 1x1 at 15 s (meta-feed channel). 2026-10-15: the 30 s look scene keeps Zee's °C words off screen (see README › °F). Music from 29.04 s of Cat Walk so the first pop is on the drop; the 15 s and 30 s end as the track drops into its breaks (a natural button ending)."
}
