{
  "$schema": "../../catalog/schemas/ad.schema.json",
  "id": "explainer",
  "title": "Curate, explained",
  "brief": "The app explainer (2:50 when complete): the problem, Zee, your wardrobe from your photos, chatting with Zee, the weather, Try-ons and 'Tell me when it's ready'. Warm and simple, for the website, YouTube and onboarding. Built so far: the opening chapter (the problem, Meet Zee, 'Already in your photos'), ported from the round-2 ExOpen motion test. The voiceover is config (config/voice.json): captions only, a human take or a TTS voice, with no code change.",
  "hook": "A wall of your own clothes that never settles, and 'Nothing to wear.'",
  "channels": ["reels", "tiktok", "youtube", "website"],
  "formats": ["9x16", "16x9"],
  "lengths": [30],
  "fps": 30,
  "track": "music.mixkit.drawing-the-sky-eugenio-mininni.v1",
  "assets": [
    "music.mixkit.drawing-the-sky-eugenio-mininni.v1",
    "font.geist.regular.v1",
    "font.geist.medium.v1",
    "font.geist.semibold.v1",
    "face.emma.b.v1",
    "zee.hello.intro.v1", "zee.hello.loop.v1",
    "zee.happy.loop.v1",
    "zee.idea.intro.v1", "zee.idea.loop.v1",
    "zee.curious.intro.v1", "zee.curious.loop.v1",
    "zee.excited.intro.v1", "zee.excited.loop.v1",
    "garment.emma.jacket-denim.v1",
    "garment.emma.tee-white.v1",
    "garment.emma.jeans-straight-light-wash.v1",
    "garment.emma.blazer-black.v1",
    "garment.emma.shirt-oxford-blue.v1",
    "garment.emma.dress-little-black.v1",
    "garment.emma.coat-trench-khaki.v1",
    "garment.emma.tee-long-sleeve-striped.v1",
    "garment.emma.hoodie-navy.v1",
    "garment.emma.skirt-midi-satin-camel.v1",
    "garment.emma.sweatpants-grey.v1",
    "garment.emma.sweater-cable-knit-cream.v1",
    "garment.emma.jacket-leather-black.v1",
    "garment.emma.shirt-flannel-plaid.v1",
    "garment.emma.jeans-straight-dark-wash.v1",
    "garment.emma.dress-slip-champagne.v1",
    "garment.emma.jacket-varsity-navy-cream.v1",
    "garment.emma.cardigan-oatmeal.v1",
    "garment.emma.trousers-black.v1",
    "garment.emma.shorts-denim-cutoff.v1",
    "garment.emma.coat-wool-camel.v1",
    "garment.emma.turtleneck-black.v1",
    "garment.emma.sneakers-leather-white.v1",
    "garment.emma.boots-cowboy-tan.v1",
    "garment.emma.bag-tote-leather-black.v1",
    "garment.emma.beanie-cream.v1"
  ],
  "components": ["Ground", "Track", "ZeeActor", "Words", "TypeOn", "Star", "PhoneFrame", "projectOnPhone", "popCurve", "Piece", "Narration", "BeatClock", "useFrameBox"],
  "status": "draft",
  "disclosures": [
    "Emma is an AI-generated persona: use the platform's AI label (TikTok 'AI-generated content', Meta 'AI info', YouTube 'altered or synthetic content').",
    "If the voice is TTS: say it is an AI voice (OpenAI's usage policies require a clear disclosure that the voice is AI-generated, not a human).",
    "A cut voiced by the 'say-preview' profile (macOS say) is PREVIEW ONLY and never ships.",
    "Music: Mixkit Stock Music Free License; YouTube and the website are fine, never register it with Content ID, no TV/radio."
  ],
  "createdBy": { "type": "agent", "name": "claude-code", "at": "2026-10-15" },
  "notes": "Words: script.json (all 26 lines of the 2:50 film). Only the opening scenes (problem, meet-zee, photos) are built; the 30-s variant is that opening. Its length follows the narration plan: 27 s on the script's hints in captions mode, longer if the voice needs it."
}
